[
  {
    "tick": 1,
    "resources": {"gold": 230, "lumber": 70},
    "supply": {"used": 9, "cap": 20},
    "units": [
      {"id": "p1", "owner": "self", "type": "peasant", "hp": 220, "position": {"x": 10, "y": 12}}
    ]
  },
  {
    "tick": 2,
    "resources": {"gold": 50, "lumber": 20},
    "supply": {"used": 10, "cap": 20},
    "units": [
      {"id": "f1", "owner": "self", "type": "footman", "hp": 420, "position": {"x": 15, "y": 16}}
    ]
  }
]
