[
  {
    "tick": 1,
    "resources": {"gold": 200, "lumber": 60},
    "supply": {"used": 10, "cap": 20},
    "units": [
      {
        "id": "u1",
        "owner": "self",
        "type": "peasant",
        "hp": 220,
        "position": {"x": 1, "y": 2}
      }
    ]
  },
  {
    "tick": 2,
    "resources": {"gold": 25, "lumber": 10},
    "supply": {"used": 10, "cap": 20},
    "units": [
      {
        "id": "u2",
        "owner": "self",
        "type": "footman",
        "hp": 420,
        "position": {"x": 3, "y": 5}
      }
    ]
  }
]
